{
  "id": "dragolance.restriction.class.ranger_campaign_review",
  "type": "restriction_rule",
  "campaign_profile_id": "campaign_profile.dragolance",
  "target_type": "class",
  "target_id": "osric.class.ranger",
  "rule": {
    "requires_campaign_review": true,
    "reason": "Ranger legality is race/table driven and remains OSRIC-based."
  },
  "notes": "Class legality relationship only; no runtime behavior changes."
}
