{
  "id": "dragolance.restriction.class.assassin_unavailable",
  "type": "restriction_rule",
  "campaign_profile_id": "campaign_profile.dragolance",
  "target_type": "class",
  "target_id": "osric.class.assassin",
  "rule": {
    "available": false,
    "maps_to": "osric.class.thief",
    "reason": "No assassin characters in Krynn."
  },
  "notes": "Class legality relationship only; no runtime behavior changes."
}
