{
  "id": "dragolance.restriction.class.druid_heathen_review",
  "type": "restriction_rule",
  "campaign_profile_id": "campaign_profile.dragolance",
  "target_type": "class",
  "target_id": "osric.class.druid",
  "rule": {
    "requires_campaign_review": true,
    "reason": "Heathen druid references appear in race class-limit tables; full legality pending deity/class work."
  },
  "notes": "Class legality relationship only; no runtime behavior changes."
}
