{
  "id": "dragolance.restriction.class.cleric_deity_required",
  "type": "restriction_rule",
  "campaign_profile_id": "campaign_profile.dragolance",
  "target_type": "class",
  "target_id": "osric.class.cleric",
  "rule": {
    "requires_deity_choice": true,
    "extension": "dragolance.extension.cleric.holy_orders"
  },
  "notes": "Class legality relationship only; no runtime behavior changes."
}
